{
    "$schema": "./cli_schema.json",
    "commands": [
        {
            "id": "ls",
            "shellCommand": "ls",
            "label": "ls",
            "description": "Lista o conteúdo de diretórios. Mostra informações sobre arquivos e pastas.",
            "color": "#5b80a5",
            "optionColor": "#7fbf7f",
            "options": [
                {
                    "flag": "-l",
                    "description": "Usa o formato de listagem longa, mostrando detalhes."
                },
                {
                    "flag": "-a",
                    "longFlag": "--all",
                    "description": "Mostra todas as entradas, incluindo as ocultas (que começam com '.')."
                },
                {
                    "flag": "-h",
                    "longFlag": "--human-readable",
                    "description": "Com -h, mostra os tamanhos de forma legível (ex: 1K, 234M, 2G)."
                },
                {
                    "flag": "-t",
                    "description": "Ordena pela data de modificação, com os mais recentes primeiro."
                },
                {
                    "flag": "-S",
                    "description": "Ordena por tamanho de arquivo, com os maiores primeiro."
                },
                {
                    "flag": "-r",
                    "longFlag": "--reverse",
                    "description": "Inverte a ordem da ordenação."
                },
                {
                    "flag": "-R",
                    "longFlag": "--recursive",
                    "description": "Lista os subdiretórios recursivamente."
                },
                {
                    "flag": "--width",
                    "description": "Controla a largura da saída, em caracteres.",
                    "argument": {
                        "type": "number",
                        "label": "Largura da tela",
                        "defaultValue": "80",
                        "validations": [
                            {
                                "regex": "^[1-9][0-9]*$",
                                "errorMessage": "A largura deve ser um número inteiro positivo."
                            }
                        ]
                    }
                }
            ],
            "exclusiveOptions": [["-t", "-S"]],
            "operands": [
                {
                    "id": "file",
                    "label": "Arquivo",
                    "description": "Um arquivo específico a ser listado.",
                    "color": "#a67f5f",
                    "type": "file",
                    "defaultValue": "arquivo.txt",
                    "cardinality": {
                        "min": 0,
                        "max": "unlimited"
                    },
                    "validations": [
                        {
                            "regex": "^[^/\\0;]*$",
                            "errorMessage": "Nome de arquivo inválido (não pode conter '/')."
                        }
                    ]
                },
                {
                    "id": "folder",
                    "label": "Pasta",
                    "description": "Um diretório a ser listado. Se omitido, usa o diretório atual.",
                    "color": "#a67f5f",
                    "type": "folder",
                    "defaultValue": ".",
                    "cardinality": {
                        "min": 0,
                        "max": "unlimited"
                    },
                    "validations": [
                        {
                            "regex": "^[^;\\0]*$",
                            "errorMessage": "Caminho de pasta contém caracteres inválidos."
                        }
                    ]
                }
            ]
        },
        {
            "id": "cd",
            "shellCommand": "cd",
            "label": "cd",
            "description": "Altera o diretório de trabalho atual.",
            "color": "#7fc37f",
            "optionColor": "#7fbf7f",
            "options": [],
            "operands": [
                {
                    "id": "directory",
                    "label": "Diretório",
                    "description": "Diretório para o qual navegar.",
                    "color": "#a67f5f",
                    "type": "folder",
                    "defaultValue": "~",
                    "cardinality": {
                        "min": 1,
                        "max": 1
                    },
                    "validations": [
                        {
                            "regex": "^[^\\0;]+$",
                            "errorMessage": "Caminho de diretório inválido."
                        }
                    ]
                }
            ]
        },
        {
            "id": "mkdir",
            "shellCommand": "mkdir",
            "label": "mkdir",
            "description": "Cria diretórios.",
            "color": "#8e44ad",
            "optionColor": "#7fbf7f",
            "options": [
                {
                    "flag": "-p",
                    "longFlag": "--parents",
                    "description": "Cria diretórios pais conforme necessário e não gera erro se já existirem."
                },
                {
                    "flag": "-v",
                    "longFlag": "--verbose",
                    "description": "Exibe uma mensagem para cada diretório criado."
                },
                {
                    "flag": "-m",
                    "longFlag": "--mode",
                    "description": "Define as permissões do diretório usando notação octal (por exemplo: 755)."
                }
            ],
            "operands": [
                {
                    "id": "directories",
                    "label": "Diretórios",
                    "description": "Diretórios a serem criados.",
                    "color": "#a67f5f",
                    "type": "folder",
                    "defaultValue": "nova_pasta",
                    "cardinality": {
                        "min": 1,
                        "max": "unlimited"
                    },
                    "validations": [
                        {
                            "regex": "^[^\\0;]+$",
                            "errorMessage": "Nome de diretório inválido."
                        }
                    ]
                }
            ]
        },
        {
            "id": "cp",
            "shellCommand": "cp",
            "label": "cp",
            "description": "Copia arquivos e diretórios.",
            "color": "#6a9fb5",
            "optionColor": "#7fbf7f",
            "options": [
                {
                    "flag": "-r",
                    "longFlag": "--recursive",
                    "description": "Copia diretórios recursivamente."
                },
                {
                    "flag": "-v",
                    "longFlag": "--verbose",
                    "description": "Exibe o que está sendo copiado."
                },
                {
                    "flag": "-f",
                    "longFlag": "--force",
                    "description": "Força a cópia sobrescrevendo arquivos existentes."
                }
            ],
            "operands": [
                {
                    "id": "source",
                    "label": "Origem",
                    "description": "Arquivo ou diretório de origem.",
                    "color": "#a67f5f",
                    "type": "file",
                    "defaultValue": "origem.txt",
                    "cardinality": {
                        "min": 1,
                        "max": "unlimited"
                    },
                    "validations": [
                        {
                            "regex": "^[^\\0;]*$",
                            "errorMessage": "Caminho inválido."
                        }
                    ]
                },
                {
                    "id": "destination",
                    "label": "Destino",
                    "description": "Arquivo ou diretório de destino.",
                    "color": "#a67f5f",
                    "type": "file",
                    "defaultValue": "destino.txt",
                    "cardinality": {
                        "min": 1,
                        "max": 1
                    },
                    "validations": [
                        {
                            "regex": "^[^\\0;]*$",
                            "errorMessage": "Caminho inválido."
                        }
                    ]
                }
            ],
            "operandIdsSequenceDelimiter": "-",
            "operandSyntaxRules": [
                {
                    "regexPattern": "(source-)+destination-",
                    "errorMessage": null
                },
                {
                    "regexPattern": "destination-(source-)+",
                    "errorMessage": "O 'Destino' deve ser sempre o último bloco do comando cp."
                }
            ]
        },
        {
            "id": "mv",
            "shellCommand": "mv",
            "label": "mv",
            "description": "Move ou renomeia arquivos e diretórios.",
            "color": "#6ab56a",
            "optionColor": "#7fbf7f",
            "options": [
                {
                    "flag": "-f",
                    "description": "Força a movimentação sobrescrevendo arquivos existentes."
                },
                {
                    "flag": "-v",
                    "description": "Exibe o que está sendo movido."
                }
            ],
            "operands": [
                {
                    "id": "source",
                    "label": "Origem",
                    "description": "Arquivo ou diretório de origem.",
                    "color": "#a67f5f",
                    "type": "file",